{
  "$schema": "gds.pc_animation.v1",
  "cell_size_px": [
    50,
    32
  ],
  "contract_id": "registry.gds.pc_animation.v1",
  "families": {
    "pc_000": {
      "animated_asset_ids": [
        "pc_000.slot_01",
        "pc_000.slot_02",
        "pc_000.slot_03",
        "pc_000.slot_04",
        "pc_000.slot_05"
      ],
      "cell_layout": {
        "cell0": "SE/SW static",
        "cell1": "NW/NE frame 0",
        "cell2": "NW/NE frame 1",
        "cell3": "NW/NE frame 2",
        "cell4": "NW/NE frame 3",
        "cell5": "NW/NE frame 4"
      },
      "direction_policy": {
        "NE": "animated_asset_ids_mirrored_at_workseat_composition",
        "NW": "animated_asset_ids",
        "SE": "static_asset_id",
        "SW": "static_asset_id"
      },
      "family_id": "pc_000",
      "source_sheet": "01_KAIRO_SPRITE_PACKS/office/pc_000.png",
      "source_sheet_sha256": "e6522c3024cfcc29e6bb9322213d1e07ba48ff53f7644b5e1dd32c17563f7d8a",
      "static_asset_id": "pc_000.slot_00"
    },
    "pc_001": {
      "animated_asset_ids": [
        "pc_001.slot_01",
        "pc_001.slot_02",
        "pc_001.slot_03",
        "pc_001.slot_04",
        "pc_001.slot_05"
      ],
      "cell_layout": {
        "cell0": "SE/SW static",
        "cell1": "NW/NE frame 0",
        "cell2": "NW/NE frame 1",
        "cell3": "NW/NE frame 2",
        "cell4": "NW/NE frame 3",
        "cell5": "NW/NE frame 4"
      },
      "direction_policy": {
        "NE": "animated_asset_ids_mirrored_at_workseat_composition",
        "NW": "animated_asset_ids",
        "SE": "static_asset_id",
        "SW": "static_asset_id"
      },
      "family_id": "pc_001",
      "source_sheet": "01_KAIRO_SPRITE_PACKS/office/pc_001.png",
      "source_sheet_sha256": "dab392dfc721d27ef4d5750fc02c03af747e8a7beca42f2d86357b330ed7de35",
      "static_asset_id": "pc_001.slot_00"
    },
    "pc_002": {
      "animated_asset_ids": [
        "pc_002.slot_01",
        "pc_002.slot_02",
        "pc_002.slot_03",
        "pc_002.slot_04",
        "pc_002.slot_05"
      ],
      "cell_layout": {
        "cell0": "SE/SW static",
        "cell1": "NW/NE frame 0",
        "cell2": "NW/NE frame 1",
        "cell3": "NW/NE frame 2",
        "cell4": "NW/NE frame 3",
        "cell5": "NW/NE frame 4"
      },
      "direction_policy": {
        "NE": "animated_asset_ids_mirrored_at_workseat_composition",
        "NW": "animated_asset_ids",
        "SE": "static_asset_id",
        "SW": "static_asset_id"
      },
      "family_id": "pc_002",
      "source_sheet": "01_KAIRO_SPRITE_PACKS/office/pc_002.png",
      "source_sheet_sha256": "cd93c0d503f72f198f5be6bac5c0ab024ae1efcbbf3b988b4d41e014bf130727",
      "static_asset_id": "pc_002.slot_00"
    },
    "pc_003": {
      "animated_asset_ids": [
        "pc_003.slot_01",
        "pc_003.slot_02",
        "pc_003.slot_03",
        "pc_003.slot_04",
        "pc_003.slot_05"
      ],
      "cell_layout": {
        "cell0": "SE/SW static",
        "cell1": "NW/NE frame 0",
        "cell2": "NW/NE frame 1",
        "cell3": "NW/NE frame 2",
        "cell4": "NW/NE frame 3",
        "cell5": "NW/NE frame 4"
      },
      "direction_policy": {
        "NE": "animated_asset_ids_mirrored_at_workseat_composition",
        "NW": "animated_asset_ids",
        "SE": "static_asset_id",
        "SW": "static_asset_id"
      },
      "family_id": "pc_003",
      "source_sheet": "01_KAIRO_SPRITE_PACKS/office/pc_003.png",
      "source_sheet_sha256": "1c725607a9b38da5d4eeeee3646feb176c7a14c99c494fee3fa5d1844b47546c",
      "static_asset_id": "pc_003.slot_00"
    },
    "pc_004": {
      "animated_asset_ids": [
        "pc_004.slot_01",
        "pc_004.slot_02",
        "pc_004.slot_03",
        "pc_004.slot_04",
        "pc_004.slot_05"
      ],
      "cell_layout": {
        "cell0": "SE/SW static",
        "cell1": "NW/NE frame 0",
        "cell2": "NW/NE frame 1",
        "cell3": "NW/NE frame 2",
        "cell4": "NW/NE frame 3",
        "cell5": "NW/NE frame 4"
      },
      "direction_policy": {
        "NE": "animated_asset_ids_mirrored_at_workseat_composition",
        "NW": "animated_asset_ids",
        "SE": "static_asset_id",
        "SW": "static_asset_id"
      },
      "family_id": "pc_004",
      "source_sheet": "01_KAIRO_SPRITE_PACKS/office/pc_004.png",
      "source_sheet_sha256": "da445117f63dd1f6ab0c6be9189b991fa384645da7cfe7649560cb1c6881527c",
      "static_asset_id": "pc_004.slot_00"
    },
    "pc_005": {
      "animated_asset_ids": [
        "pc_005.slot_01",
        "pc_005.slot_02",
        "pc_005.slot_03",
        "pc_005.slot_04",
        "pc_005.slot_05"
      ],
      "cell_layout": {
        "cell0": "SE/SW static",
        "cell1": "NW/NE frame 0",
        "cell2": "NW/NE frame 1",
        "cell3": "NW/NE frame 2",
        "cell4": "NW/NE frame 3",
        "cell5": "NW/NE frame 4"
      },
      "direction_policy": {
        "NE": "animated_asset_ids_mirrored_at_workseat_composition",
        "NW": "animated_asset_ids",
        "SE": "static_asset_id",
        "SW": "static_asset_id"
      },
      "family_id": "pc_005",
      "source_sheet": "01_KAIRO_SPRITE_PACKS/office/pc_005.png",
      "source_sheet_sha256": "18cbf7b8333dae95c147a6b0aa7918d146cb997732fa41ce42b382ba80ea5370",
      "static_asset_id": "pc_005.slot_00"
    },
    "pc_006": {
      "animated_asset_ids": [
        "pc_006.slot_01",
        "pc_006.slot_02",
        "pc_006.slot_03",
        "pc_006.slot_04",
        "pc_006.slot_05"
      ],
      "cell_layout": {
        "cell0": "SE/SW static",
        "cell1": "NW/NE frame 0",
        "cell2": "NW/NE frame 1",
        "cell3": "NW/NE frame 2",
        "cell4": "NW/NE frame 3",
        "cell5": "NW/NE frame 4"
      },
      "direction_policy": {
        "NE": "animated_asset_ids_mirrored_at_workseat_composition",
        "NW": "animated_asset_ids",
        "SE": "static_asset_id",
        "SW": "static_asset_id"
      },
      "family_id": "pc_006",
      "source_sheet": "01_KAIRO_SPRITE_PACKS/office/pc_006.png",
      "source_sheet_sha256": "6d55dd0f1c107f37fd83cebf38f3e5ace5caf1f05345b007dcf8234f34fb8860",
      "static_asset_id": "pc_006.slot_00"
    },
    "pc_007": {
      "animated_asset_ids": [
        "pc_007.slot_01",
        "pc_007.slot_02",
        "pc_007.slot_03",
        "pc_007.slot_04",
        "pc_007.slot_05"
      ],
      "cell_layout": {
        "cell0": "SE/SW static",
        "cell1": "NW/NE frame 0",
        "cell2": "NW/NE frame 1",
        "cell3": "NW/NE frame 2",
        "cell4": "NW/NE frame 3",
        "cell5": "NW/NE frame 4"
      },
      "direction_policy": {
        "NE": "animated_asset_ids_mirrored_at_workseat_composition",
        "NW": "animated_asset_ids",
        "SE": "static_asset_id",
        "SW": "static_asset_id"
      },
      "family_id": "pc_007",
      "source_sheet": "01_KAIRO_SPRITE_PACKS/office/pc_007.png",
      "source_sheet_sha256": "c04c20a738d5129e213bad591517202a91406c5305f969d6b738f171580e0af0",
      "static_asset_id": "pc_007.slot_00"
    },
    "pc_008": {
      "animated_asset_ids": [
        "pc_008.slot_01",
        "pc_008.slot_02",
        "pc_008.slot_03",
        "pc_008.slot_04",
        "pc_008.slot_05"
      ],
      "cell_layout": {
        "cell0": "SE/SW static",
        "cell1": "NW/NE frame 0",
        "cell2": "NW/NE frame 1",
        "cell3": "NW/NE frame 2",
        "cell4": "NW/NE frame 3",
        "cell5": "NW/NE frame 4"
      },
      "direction_policy": {
        "NE": "animated_asset_ids_mirrored_at_workseat_composition",
        "NW": "animated_asset_ids",
        "SE": "static_asset_id",
        "SW": "static_asset_id"
      },
      "family_id": "pc_008",
      "source_sheet": "01_KAIRO_SPRITE_PACKS/office/pc_008.png",
      "source_sheet_sha256": "419d310bd4cbdbdbbc5a8ca20a8e212ebe336c1cda625de073cb1cf180fdaa7d",
      "static_asset_id": "pc_008.slot_00"
    },
    "pc_009": {
      "animated_asset_ids": [
        "pc_009.slot_01",
        "pc_009.slot_02",
        "pc_009.slot_03",
        "pc_009.slot_04",
        "pc_009.slot_05"
      ],
      "cell_layout": {
        "cell0": "SE/SW static",
        "cell1": "NW/NE frame 0",
        "cell2": "NW/NE frame 1",
        "cell3": "NW/NE frame 2",
        "cell4": "NW/NE frame 3",
        "cell5": "NW/NE frame 4"
      },
      "direction_policy": {
        "NE": "animated_asset_ids_mirrored_at_workseat_composition",
        "NW": "animated_asset_ids",
        "SE": "static_asset_id",
        "SW": "static_asset_id"
      },
      "family_id": "pc_009",
      "source_sheet": "01_KAIRO_SPRITE_PACKS/office/pc_009.png",
      "source_sheet_sha256": "3f16793207e05ca8061aac87f8747b6d7774b68c9f471bd7cc837dcafb68bea3",
      "static_asset_id": "pc_009.slot_00"
    },
    "pc_011": {
      "animated_asset_ids": [
        "pc_011.slot_01",
        "pc_011.slot_02",
        "pc_011.slot_03",
        "pc_011.slot_04",
        "pc_011.slot_05"
      ],
      "cell_layout": {
        "cell0": "SE/SW static",
        "cell1": "NW/NE frame 0",
        "cell2": "NW/NE frame 1",
        "cell3": "NW/NE frame 2",
        "cell4": "NW/NE frame 3",
        "cell5": "NW/NE frame 4"
      },
      "direction_policy": {
        "NE": "animated_asset_ids_mirrored_at_workseat_composition",
        "NW": "animated_asset_ids",
        "SE": "static_asset_id",
        "SW": "static_asset_id"
      },
      "family_id": "pc_011",
      "source_sheet": "01_KAIRO_SPRITE_PACKS/office/pc_011.png",
      "source_sheet_sha256": "84408244af35cc388b109e0916726a003bd9d0952a45c035f5da81acef8246dc",
      "static_asset_id": "pc_011.slot_00"
    },
    "pc_012": {
      "animated_asset_ids": [
        "pc_012.slot_01",
        "pc_012.slot_02",
        "pc_012.slot_03",
        "pc_012.slot_04",
        "pc_012.slot_05"
      ],
      "cell_layout": {
        "cell0": "SE/SW static",
        "cell1": "NW/NE frame 0",
        "cell2": "NW/NE frame 1",
        "cell3": "NW/NE frame 2",